よさこい祭り名,イメージ画像URL,公式ホームページURL,開催期間,開催地,参加チーム数,最寄り駅,駐車場情報,イベント紹介,動画リンク（YouTube）,会場緯度,会場経度
虹彩よさこい,,https://www.nijiyosa.com/,2026年3月8日,松菱跡地メイン会場など,約42チーム,JR浜松駅,周辺に有料駐車場,"遠州地区での｢よさこい踊り｣を普及を目的とし、様々なカラーを持った県内外のチームで浜松を彩ってほしいという思いから｢虹彩よさこい｣を開催します。

地元チームが立ち上がり自分たちの手で作り上げる温かいよさこいイベントを目指します。",https://www.youtube.com/watch?v=-SpR1cFkVrg,34.7054816609125,137.731156869317
堺よさこいかえる祭り,,https://x.com/sakai_kaeru,2026年3月1日,国際障害者交流センター ビッグ・アイ多目的ホール、交流広場、大仙公園 芝生広場[予定] ,未定,泉ケ丘駅,不明,"堺よさこいかえる祭りは、10 年以上にわたり堺の地で愛されてきた祭りです。一度は開催が中断されたもの
の、地域の方々からの「祭りを復活させたい」という熱い声を受け、2023 年に大学生を中心とした新たな実行委
員会が発足し、再出発を果たしました。
本祭りでは、発足当初からの開催趣旨である

「人をかえる、若返る、生きかえる、街をかえる、故郷にかえる」
という理念を継承し、堺の街により一層の活力を育むことができればと考えております。",https://www.youtube.com/watch?v=grG1r5YHIaM,34.5012277843835,135.538417760618
雷都よさこいフェスティバル,,https://www.instagram.com/light_yosakoi.fes/,2026年1月18日,栃木県宇都宮市,10チーム以上,JR宇都宮駅,不明,栃木県宇都宮市からよさこい祭りを発信しようと作ったお祭りです。 雷都とは、宇都宮市が雷の都と呼ばれるほど雷が多い土地柄からきています。 みんなで作り上げる、みんなが幸せになれる。コンセプトは、『競演』ではなく、『共演』です。 すべての人にリスペクトを❣️,https://www.youtube.com/watch?v=_UEoXMBt8GE,36.559066849833,139.898269719914
冬のよさこいソーズラ祭り,,https://itospa.com/event/detail_10025.html,2025年12月20日,静岡県伊東市東松原178-36,約20チーム,JR伊東駅,専用駐車場なし（近隣に有料駐車場あり）,"12月の夜空を彩る華やかな花火と、熱狂的なダンスパフォーマンスが競演する「とっておき冬花火大会＆冬のよさこいソーズラ祭り」。

個性的な衣装や振り付けで舞競うよさこいソーズラ踊りが始まると会場周辺は大盛り上がりです。

最後に海上からファンタジックな花火が打ち上げられ、祭りのフィナーレを飾ります。",https://www.youtube.com/watch?v=sS8mYn7L2c8,34.9726926467883,139.100069653975
YOSAKOI高松祭り,,https://kgwyosakoi.wixsite.com/yosakoitakamatsu,2025年12月13日～14日,香川県高松市（主会場：史跡高松城址玉藻公園など）,約25チーム,JR高松駅,周辺に有料駐車場,「日本一小さな香川県から日本一元気なお祭りを」がコンセプトのお祭りです！ また、踊りを通じて沢山の人と繋がり、全国に元気を届けられるお祭りを目指しています,https://www.youtube.com/watch?v=ol3S7hDAux8,34.3503,134.0516
瑞浪バサラカーニバル,,https://xn--w0w51m.com/news/%e3%82%a4%e3%83%99%e3%83%b3%e3%83%88%e3%81%ae%e7%b4%b9%e4%bb%8b/p8949/,2025年12月13日～14日,岐阜県瑞浪市,約150チーム,JR瑞浪駅,臨時駐車場あり,"瑞浪から全国に元気を発信！！

学生からおとなまで、老若男女みんなで楽しむ年末恒例の踊り納めイベント。全国各地から集結した踊り子たちが、工夫を凝らした鮮やかな衣装でダイナミックな踊りとパレードを繰り広げます。まさに、「瑞浪から全国に元気を発信！」するお祭です。産地直送の北の幸「バサカニ名物北海道物産市」や安くてうまいものが揃う「おかみさん横丁」、手軽に味わうキッチンカーも会場に多数スタンバイしています。",https://www.youtube.com/watch?v=iTrgqMNC83k,35.3641,137.2531
ざわめき祭,,https://x.com/zawameki_sai,2025年12月13日,埼玉県所沢市 市民文化センターミューズ,1チーム以上,西武新宿線 航空公園駅,文化センター駐車場あり,,https://www.youtube.com/watch?v=0xSbXUzxNgE,35.3690904872862,137.2520417
結ノYOSAKOI,,https://fukuyosa2022.official.ec/,2025年12月7日,福島県郡山市 サンサングリーン湖南,約20チーム,磐梯熱海駅,あり,"「福島YOSAKOIー乱舞ー」は、祭りの開催が減少し、福島の学生が地元で踊ることが難しくなった状況から生まれました。このイベントは、そうした学生たちが率先して輝ける場を創出したいという強い想いから企画されました。

YOSAKOIの熱気を通して地域の活性化を図り、YOSAKOI文化のさらなる振興を目指します。そして何より、参加者や地域の人々が交流を深め、『新たな繋がりを生み出す場』となることが、このイベントの大切な目的です。",https://www.youtube.com/watch?v=Emq7xDlmYYg,37.3889637707108,140.088557361009